Symbol,Name,Last Sale,Net Change,% Change,Market Cap,Country,IPO Year,Volume,Sector,Industry
CMPS,COMPASS Pathways Plc American Depository Shares,$6.39,0.12,1.914%,437012100.00,United Kingdom,2020,410770,Health Care,Biotechnology: Pharmaceutical Preparations
CNDT,Conduent Incorporated Common Stock ,$3.93,-0.05,-1.256%,638225130.00,United States,,877715,Consumer Discretionary,Business Services
CNOB,ConnectOne Bancorp Inc. Common Stock,$26.14,-0.54,-2.024%,1002945192.00,United States,,152270,Finance,Major Banks
CNOBP,ConnectOne Bancorp Inc. Depositary Shares each representing a 1/40th interest in a share of 5.25% Fixed-Rate Reset Non-Cumulative Perpetual Preferred Stock Series A,$21.90,0.15,0.69%,840263952.00,United States,,1295,Finance,Major Banks
CNSL,Consolidated Communications Holdings Inc. Common Stock,$4.63,0.00,0.00%,548548931.00,United States,2005,270348,Telecommunications,Telecommunications Equipment
CNTA,Centessa Pharmaceuticals plc American Depositary Shares,$16.05,0.24,1.518%,1818694435.00,United Kingdom,2021,392069,Health Care,Biotechnology: Pharmaceutical Preparations
CNXC,Concentrix Corporation Common Stock,$49.06,-1.26,-2.504%,3180007826.00,United States,,618886,Technology,Computer Software: Prepackaged Software
CNXN,PC Connection Inc. Common Stock,$73.63,-1.38,-1.84%,1935968463.00,United States,,57752,Consumer Discretionary,Catalog/Specialty Distribution
COCO,The Vita Coco Company Inc. Common Stock,$28.84,-0.14,-0.483%,1637601272.00,United States,2021,191380,Consumer Staples,Beverages (Production/Distribution)
COGT,Cogent Biosciences Inc. Common Stock,$11.90,0.26,2.234%,1302460510.00,United States,2018,831037,Health Care,Biotechnology: Pharmaceutical Preparations
COHU,Cohu Inc. Common Stock,$25.33,0.15,0.596%,1188472202.00,United States,,244326,Industrials,Electrical Products
COIN,Coinbase Global Inc. Class A Common Stock,$220.21,16.01,7.84%,54717278061.00,United States,,13532703,Finance,Finance: Consumer Services
COKE,Coca-Cola Consolidated Inc. Common Stock,$1287.48,-18.11,-1.387%,11279198999.00,United States,1972,35306,Consumer Staples,Beverages (Production/Distribution)
COLB,Columbia Banking System Inc. Common Stock,$27.48,-0.28,-1.009%,5756546151.00,United States,1992,1016910,Finance,Savings Institutions
COLL,Collegium Pharmaceutical Inc. Common Stock,$38.44,-0.49,-1.259%,1238296588.00,United States,2015,166913,Health Care,Biotechnology: Pharmaceutical Preparations
COLM,Columbia Sportswear Company Common Stock,$84.39,0.82,0.981%,4941204124.00,United States,1998,377592,Consumer Discretionary,Apparel
COMM,CommScope Holding Company Inc. Common Stock,$6.05,0.40,7.08%,1305893613.00,United States,2013,4035395,Technology,Radio And Television Broadcasting And Communications Equipment
COO,The Cooper Companies Inc. Common Stock,$108.26,1.48,1.386%,21560585581.00,United States,,733653,Health Care,Ophthalmic Goods
COOP,Mr. Cooper Group Inc. Common Stock,$95.31,-0.96,-0.997%,6145954409.00,United States,,395468,Finance,Finance: Consumer Services
CORT,Corcept Therapeutics Incorporated Common Stock,$49.75,2.58,5.47%,5198500333.00,United States,2004,3004740,Health Care,Biotechnology: Pharmaceutical Preparations
CORZ,Core Scientific Inc. Common Stock,$12.81,-0.20,-1.537%,3307839576.00,United States,,9312853,Finance,Finance: Consumer Services
CORZW,Core Scientific Inc. Tranche 1 Warrants,$7.43,-0.13,-1.72%,1918598599.00,United States,,804630,Finance,Finance: Consumer Services
CORZZ,Core Scientific Inc. Tranche 2 Warrants,$12.79,-0.17,-1.312%,3302675112.00,United States,,274635,Finance,Finance: Consumer Services
COST,Costco Wholesale Corporation Common Stock,$889.56,4.27,0.482%,394140495574.00,United States,,1653327,Consumer Discretionary,Department/Specialty Retail Stores
CPB,Campbell Soup Company Common Stock,$48.50,-0.21,-0.431%,14458136926.00,United States,,1776278,Consumer Staples,Packaged Foods
CPRT,Copart Inc. (DE) Common Stock,$53.88,0.19,0.354%,51901923819.00,United States,1994,8537730,Consumer Discretionary,Retail-Auto Dealers and Gas Stations
CPRX,Catalyst Pharmaceuticals Inc. Common Stock,$21.24,0.08,0.378%,2520930932.00,United States,2006,1162455,Health Care,Biotechnology: Pharmaceutical Preparations
CPZ,Calamos Long/Short Equity & Dynamic Income Trust Common Stock,$15.55,-0.02,-0.128%,305280617.00,United States,2019,26693,Finance,Trusts Except Educational Religious and Charitable
CRAI,CRA International Inc. Common Stock,$197.25,0.93,0.474%,1337297798.00,United States,1998,36352,Consumer Discretionary,Other Consumer Services
CRCT,Cricut Inc. Class A Common Stock,$6.77,0.06,0.894%,1464811258.00,United States,2021,217256,Technology,Industrial Machinery/Components
CRDO,Credo Technology Group Holding Ltd Ordinary Shares,$37.31,-0.30,-0.798%,6195863697.00,United States,2022,1663212,Technology,Semiconductors
CRESW,Cresud S.A.C.I.F. y A. Warrant,$0.56,-0.02,-3.448%,335609478.00,Argentina,,8478,Finance,Real Estate
CRESY,Cresud S.A.C.I.F. y A. American Depositary Shares,$8.95,-0.11,-1.214%,536375863.00,Argentina,1997,104459,Finance,Real Estate
CRGX,CARGO Therapeutics Inc. Common Stock,$22.22,0.52,2.396%,1020000967.00,United States,2023,156892,,
CRMD,CorMedix Inc. Common Stock,$11.01,0.52,4.957%,615018204.00,United States,,751174,Health Care,Biotechnology: Pharmaceutical Preparations
CRML,Critical Metals Corp. Ordinary Shares,$7.00,-0.02,-0.285%,634480000.00,British Virgin Islands,,6254,Basic Materials,Metal Mining
CRNX,Crinetics Pharmaceuticals Inc. Common Stock,$59.09,0.17,0.289%,4729304195.00,United States,2018,510476,Health Care,Biotechnology: Pharmaceutical Preparations
CRON,Cronos Group Inc. Common Share,$2.18,0.03,1.395%,833371981.00,Canada,,431593,Health Care, Medicinal Chemicals and Botanical Products 
CROX,Crocs Inc. Common Stock,$139.40,3.31,2.432%,8278287401.00,United States,2006,894938,Consumer Discretionary,Shoe Manufacturing
CRSP,CRISPR Therapeutics AG Common Shares,$48.92,0.63,1.305%,4166426289.00,Switzerland,2016,781635,Health Care,Biotechnology: Biological Products (No Diagnostic Substances)
CRSR,Corsair Gaming Inc. Common Stock,$6.67,-0.08,-1.185%,694656355.00,United States,2020,324172,Technology,Computer peripheral equipment
CRTO,Criteo S.A. American Depositary Shares,$42.86,-0.24,-0.557%,2399521986.00,France,2013,339703,Consumer Discretionary,Advertising
CRUS,Cirrus Logic Inc. Common Stock,$124.83,1.96,1.595%,6667320720.00,United States,1989,459215,Technology,Semiconductors
CRVL,CorVel Corp. Common Stock,$312.79,-5.11,-1.607%,5358465858.00,United States,,18079,Finance,Specialty Insurers
CRVS,Corvus Pharmaceuticals Inc. Common Stock,$7.21,0.00,0.00%,450994736.00,United States,2016,611422,Health Care,Biotechnology: Pharmaceutical Preparations
CRWD,CrowdStrike Holdings Inc. Class A Common Stock,$310.15,-0.19,-0.061%,76025959163.00,United States,2019,2894493,Technology,Computer Software: Prepackaged Software
CSCO,Cisco Systems Inc. Common Stock (DE),$56.76,0.36,0.638%,226514106907.00,United States,1990,17678173,Telecommunications,Computer Communications Equipment
CSGP,CoStar Group Inc. Common Stock,$79.25,0.92,1.175%,32477985204.00,United States,1998,2718136,Consumer Discretionary,Business Services
CSGS,CSG Systems International Inc. Common Stock,$48.73,-0.34,-0.693%,1437684065.00,United States,1996,157779,Technology,EDP Services
CSIQ,Canadian Solar Inc. Common Shares (ON),$12.55,0.28,2.282%,830292200.00,Canada,2006,2185303,Technology,Semiconductors
CSQ,Calamos Strategic Total Return Common Stock,$17.62,0.09,0.513%,2799599900.00,United States,2004,148284,Finance,Finance Companies
CSTL,Castle Biosciences Inc. Common Stock,$32.64,-0.42,-1.27%,905327846.00,United States,2019,281447,Health Care,Medical Specialities
CSWC,Capital Southwest Corporation Common Stock,$25.64,0.00,0.00%,1201769799.00,United States,,159759,Consumer Discretionary,Textiles
CSWCZ,Capital Southwest Corporation 7.75% Notes due 2028,$25.64,-0.06,-0.233%,1201769799.00,United States,,2338,Finance,Finance Companies
CSWI,CSW Industrials Inc. Common Stock,$391.63,0.47,0.12%,6082302531.00,United States,,78243,Industrials,Home Furnishings
CSX,CSX Corporation Common Stock,$34.12,1.03,3.113%,66149797233.00,United States,,21248042,Industrials,Railroads
CTAS,Cintas Corporation Common Stock,$214.02,0.20,0.094%,86313973435.00,United States,1983,1247945,Consumer Discretionary,Apparel
CTBI,Community Trust Bancorp Inc. Common Stock,$52.48,1.00,1.943%,947376675.00,United States,,44254,Finance,Major Banks
CTKB,Cytek Biosciences Inc. Common Stock,$5.17,0.03,0.584%,679883911.00,United States,2021,356649,Industrials,Biotechnology: Laboratory Analytical Instruments
CTLP,Cantaloupe Inc. Common Stock,$9.25,0.12,1.314%,675122091.00,United States,,296453,Miscellaneous,Office Equipment/Supplies/Services
CTNM,Contineum Therapeutics Inc. Class A Common Stock,$16.38,-0.10,-0.607%,421347261.00,United States,2024,83087,Health Care,Biotechnology: Pharmaceutical Preparations
CTSH,Cognizant Technology Solutions Corporation Class A Common Stock,$78.00,0.26,0.334%,38661322128.00,United States,1998,3058472,Technology,EDP Services
CUB,Lionheart Holdings Class A Ordinary Shares,$10.01,0.00,0.00%,318003446.00,United States,2024,7422,Industrials,Industrial Machinery/Components
CVAC,CureVac N.V. Ordinary Shares,$2.80,-0.02,-0.709%,627168290.00,Germany,2020,165182,Health Care,Biotechnology: Pharmaceutical Preparations
CVBF,CVB Financial Corporation Common Stock,$19.55,-0.22,-1.113%,2730800206.00,United States,,560418,Finance,Major Banks
CVCO,Cavco Industries Inc. Common Stock When Issued,$448.26,2.76,0.62%,3699611707.00,United States,,38355,Consumer Discretionary,Homebuilding
CVGW,Calavo Growers Inc. Common Stock,$28.55,-0.29,-1.006%,508234938.00,United States,,122896,Consumer Discretionary,Specialty Foods
CVLT,Commvault Systems Inc. Common Stock,$140.87,-1.70,-1.192%,6157898488.00,United States,2006,288486,Technology,Computer Software: Prepackaged Software
CWBC,Community West Bancshares Common Stock,$19.09,-0.12,-0.625%,361575252.00,United States,,25482,Finance,Major Banks
CWCO,Consolidated Water Co. Ltd. Ordinary Shares,$25.94,-0.14,-0.537%,410745866.00,Cayman Islands,,260049,Utilities,Water Supply
CWST,Casella Waste Systems Inc. Class A Common Stock,$104.07,-2.23,-2.098%,6049994661.00,United States,1997,404897,Utilities,Environmental Services
CYBR,CyberArk Software Ltd. Ordinary Shares,$299.98,4.33,1.465%,12675755693.00,Israel,2014,443847,Technology,Computer Software: Prepackaged Software
CYRX,CryoPort Inc. Common Stock,$7.55,0.42,5.891%,373062820.00,United States,,263482,Health Care,Biotechnology: Pharmaceutical Preparations
CYTK,Cytokinetics Incorporated Common Stock,$54.97,0.44,0.807%,6467747003.00,United States,2004,1416368,Health Care,Biotechnology: Pharmaceutical Preparations
CZR,Caesars Entertainment Inc. Common Stock,$45.18,-0.37,-0.812%,9774149711.00,United States,,1524094,Consumer Discretionary,Hotels/Resorts
DADA,Dada Nexus Limited American Depositary Shares,$1.64,0.14,9.333%,433087659.00,China,2020,1905031,Technology,Computer Software: Programming Data Processing
DAKT,Daktronics Inc. Common Stock,$13.55,-0.16,-1.167%,632092094.00,United States,1994,419804,Consumer Discretionary,Miscellaneous manufacturing industries
DASH,DoorDash Inc. Class A Common Stock,$151.98,0.58,0.383%,62546051029.00,United States,,1791227,Consumer Discretionary,Business Services
DAVE,Dave Inc. Class A Common Stock,$42.63,-0.16,-0.374%,540089701.00,United States,,602086,Finance,Finance: Consumer Services
DAWN,Day One Biopharmaceuticals Inc. Common Stock,$15.01,-0.07,-0.464%,1475633100.00,United States,2021,530372,Health Care,Biotechnology: Pharmaceutical Preparations
DBX,Dropbox Inc. Class A Common Stock,$26.47,0.10,0.379%,8613803872.00,United States,2018,2417498,Technology,Computer Software: Prepackaged Software
DCBO,Docebo Inc. Common Shares,$46.15,0.15,0.326%,1395157281.00,Canada,,39981,Technology,Computer Software: Prepackaged Software
DCGO,DocGo Inc. Common Stock,$3.40,0.01,0.295%,347878565.00,United States,2020,197004,Health Care,Medical/Nursing Services
DCOM,Dime Community Bancshares Inc. Common Stock,$30.66,-0.79,-2.512%,1200297210.00,United States,,185030,Finance,Major Banks
DCOMG,Dime Community Bancshares Inc. 9.000% Fixed-to-Floating Rate Subordinated Notes due 2034,$27.22,0.01,0.037%,1065625899.00,United States,,3517,Finance,Major Banks
DCOMP,Dime Community Bancshares Inc. Fixed-Rate Non-Cumulative Perpetual Preferred Stock Series A,$20.57,0.17,0.833%,805287463.00,United States,,5844,Finance,Major Banks
DCTH,Delcath Systems Inc. Common Stock,$11.28,1.05,10.264%,315834608.00,United States,,818848,Health Care,Medical/Dental Instruments
DDI,DoubleDown Interactive Co. Ltd. American Depository Shares,$14.62,-0.28,-1.879%,724471293.00,South Korea,2021,46855,Technology,EDP Services
DDOG,Datadog Inc. Class A Common Stock,$128.12,1.90,1.505%,39859459323.00,United States,2019,3575058,Technology,Computer Software: Prepackaged Software
DENN,Denny's Corporation Common Stock,$6.65,-0.04,-0.598%,341636894.00,United States,,378861,Consumer Discretionary,Restaurants
DGICA,Donegal Group Inc. Class A Common Stock,$14.88,-0.17,-1.13%,498236712.00,United States,,25979,Finance,Property-Casualty Insurers
DGICB,Donegal Group Inc. Class B Common Stock,$13.40,0.00,0.00%,448680910.00,United States,1986,19,Finance,Property-Casualty Insurers
DGII,Digi International Inc. Common Stock,$30.70,-0.05,-0.163%,1117946149.00,United States,1989,128254,Telecommunications,Computer Communications Equipment
DH,Definitive Healthcare Corp. Class A Common Stock,$4.54,0.07,1.566%,531738928.00,United States,2021,361910,Technology,Computer Software: Prepackaged Software
DHC,Diversified Healthcare Trust Common Shares of Beneficial Interest,$3.70,-0.02,-0.538%,890126061.00,United States,,508826,Real Estate,Real Estate Investment Trusts
DHCNI,Diversified Healthcare Trust 5.625% Senior Notes due 2042,$16.585,-0.005,-0.03%,3989929923.00,United States,,10242,Real Estate,Real Estate Investment Trusts
DHCNL,Diversified Healthcare Trust 6.25% Senior Notes Due 2046,$17.70,-0.01,-0.056%,4258170615.00,United States,,8644,Real Estate,Real Estate Investment Trusts
DHIL,Diamond Hill Investment Group Inc. Class A Common Stock,$160.90,-0.92,-0.569%,442639601.00,United States,,7328,Finance,Investment Managers
DIOD,Diodes Incorporated Common Stock,$63.98,-0.96,-1.478%,2964294552.00,United States,,207878,Technology,Semiconductors
DJCO,Daily Journal Corp. (S.C.) Common Stock,$492.42,-8.79,-1.754%,678272111.00,United States,,3160,Consumer Discretionary,Newspapers/Magazines
DJT,Trump Media & Technology Group Corp. Common Stock,$29.58,-0.32,-1.07%,5759692536.00,United States,2024,26942140,Technology,Computer Software: Programming Data Processing
DJTWW,Trump Media & Technology Group Corp. Warrants,$21.72,-0.6295,-2.817%,4229226568.00,United States,2021,381438,Technology,Computer Software: Programming Data Processing
DKNG,DraftKings Inc. Class A Common Stock,$38.46,0.81,2.151%,18673499376.00,United States,2019,7603300,Consumer Discretionary,Services-Misc. Amusement & Recreation
DLO,DLocal Limited Class A Common Shares,$8.72,-0.28,-3.111%,2581047319.00,Uruguay,2021,983777,Consumer Discretionary,Business Services
DLTR,Dollar Tree Inc. Common Stock,$68.20,0.34,0.501%,14662462516.00,United States,1995,3447912,Consumer Discretionary,Department/Specialty Retail Stores
DMLP,Dorchester Minerals L.P. Common Units Representing Limited Partnership Interests,$32.92,1.07,3.359%,1319717107.00,United States,,87462,Energy,Oil & Gas Production
DMRC,Digimarc Corporation Common Stock,$30.00,0.50,1.695%,642618750.00,United States,,71223,Technology,EDP Services
DNLI,Denali Therapeutics Inc. Common Stock,$27.59,0.17,0.62%,3949929634.00,United States,2017,514767,Health Care,Biotechnology: Biological Products (No Diagnostic Substances)
DNTH,Dianthus Therapeutics Inc. Common Stock,$29.05,1.02,3.639%,852742996.00,United States,2018,212699,Health Care,Biotechnology: Pharmaceutical Preparations
DNUT,Krispy Kreme Inc. Common Stock,$11.59,0.12,1.046%,1965664000.00,United States,2021,1002389,Consumer Staples,Food Chains
DOCU,DocuSign Inc. Common Stock,$72.30,-0.20,-0.276%,14674927150.00,United States,1989,2315968,Technology,Computer Software: Prepackaged Software
DOGZ,Dogness (International) Corporation Class A Common Stock,$40.00,2.74,7.354%,424870520.00,China,2017,26938,Consumer Discretionary,Miscellaneous manufacturing industries
DOMO,Domo Inc. Class B Common Stock,$7.78,-0.05,-0.639%,300548137.00,United States,2018,381558,Technology,Computer Software: Prepackaged Software
DOOO,BRP Inc. (Recreational Products) Common Subordinate Voting Shares,$57.50,0.23,0.402%,4197647028.00,Canada,,118845,Consumer Discretionary,Industrial Specialties
DORM,Dorman Products Inc. Common Stock,$116.88,-1.26,-1.067%,3573288905.00,United States,,118341,Consumer Discretionary,Auto Parts:O.E.M.
DOX,Amdocs Limited Ordinary Shares,$90.99,0.05,0.055%,10677478051.00,Guernsey,,328141,Technology,EDP Services
DRS,Leonardo DRS Inc. Common Stock,$28.72,-0.13,-0.451%,7573544617.00,Israel,,734231,Industrials,Industrial Machinery/Components
DRVN,Driven Brands Holdings Inc. Common Stock,$14.67,0.12,0.825%,2407081150.00,United States,2021,861685,Consumer Discretionary,Automotive Aftermarket
DSGN,Design Therapeutics Inc. Common Stock,$5.595,-0.425,-7.06%,316791837.00,United States,2021,144830,Health Care,Biotechnology: Pharmaceutical Preparations
DSGR,Distribution Solutions Group Inc. Common Stock,$40.17,0.07,0.175%,1878243151.00,United States,,36965,Consumer Discretionary,Industrial Specialties
DSGX,Descartes Systems Group Inc. (The) Common Stock,$106.41,-0.59,-0.551%,9095993306.00,Canada,,84910,Technology,Computer Software: Prepackaged Software
DSP,Viant Technology Inc. Class A Common Stock,$11.85,-0.05,-0.42%,748909122.00,United States,2021,69089,Technology,Computer Software: Programming Data Processing
DUOL,Duolingo Inc. Class A Common Stock,$286.12,-1.53,-0.532%,12457306864.00,United States,2021,334884,Technology,Computer Software: Prepackaged Software
DVAX,Dynavax Technologies Corporation Common Stock,$10.95,0.03,0.275%,1434935994.00,United States,2004,2415754,Health Care,Biotechnology: Pharmaceutical Preparations
DXCM,DexCom Inc. Common Stock,$72.38,2.83,4.069%,29004607521.00,United States,2005,3694017,Health Care,Medical/Dental Instruments
DXPE,DXP Enterprises Inc. Common Stock,$52.06,-0.42,-0.80%,821960451.00,United States,,532222,Industrials,Industrial Machinery/Components
DYN,Dyne Therapeutics Inc. Common Stock,$35.24,0.51,1.468%,3538124122.00,United States,2020,1596541,Health Care,Biotechnology: Pharmaceutical Preparations
EA,Electronic Arts Inc. Common Stock,$144.35,0.15,0.104%,38137260040.00,United States,,1557470,Technology,Computer Software: Prepackaged Software
EBAY,eBay Inc. Common Stock,$64.95,-0.41,-0.627%,31760550000.00,United States,1998,5186485,Consumer Discretionary,Business Services
EBC,Eastern Bankshares Inc. Common Stock,$17.28,-0.20,-1.144%,3726402607.00,United States,2020,1022624,Finance,Savings Institutions
EBTC,Enterprise Bancorp Inc Common Stock,$32.87,-0.97,-2.866%,408385229.00,United States,,17948,Finance,Major Banks
ECPG,Encore Capital Group Inc Common Stock,$47.15,-0.37,-0.779%,1117028670.00,United States,,175028,Finance,Finance Companies
ECX,ECARX Holdings Inc. Class A Ordinary shares,$1.84,0.06,3.371%,621827936.00,China,,33641,Technology,EDP Services
EEFT,Euronet Worldwide Inc. Common Stock,$98.66,-0.41,-0.414%,4431240300.00,United States,1997,189495,Finance,Investment Bankers/Brokers/Service
EFSC,Enterprise Financial Services Corporation Common Stock,$53.08,-0.77,-1.43%,1983463184.00,United States,,133069,Finance,Major Banks
EFSCP,Enterprise Financial Services Corporation Depositary Shares Each Representing a 1/40th Interest in a Share of 5% Fixed Rate Non-Cumulative Perpetual Preferred Stock Series A,$22.22,0.05,0.226%,830304295.00,United States,,6226,Finance,Major Banks
EGBN,Eagle Bancorp Inc. Common Stock,$24.45,-0.37,-1.491%,737835621.00,United States,,528156,Finance,Major Banks
EH,EHang Holdings Limited ADS,$16.50,0.96,6.178%,1047844727.00,China,2019,1947084,Industrials,Military/Government/Technical
ELVN,Enliven Therapeutics Inc. Common Stock,$29.00,0.98,3.498%,1369879003.00,United States,2020,430082,Health Care,Biotechnology: Pharmaceutical Preparations
EMBC,Embecta Corp. Common Stock,$13.64,0.09,0.664%,787052961.00,United States,,265674,Health Care,Medical/Dental Instruments
ENGN,enGene Holdings Inc. Common Stock,$9.02,-0.28,-3.011%,398824505.00,Canada,,110266,Health Care,Biotechnology: Biological Products (No Diagnostic Substances)
ENLT,Enlight Renewable Energy Ltd. Ordinary Shares,$16.23,0.10,0.62%,1914533225.00,Israel,2023,4540,Utilities,Electric Utilities: Central
ENPH,Enphase Energy Inc. Common Stock,$91.64,0.07,0.076%,12410086651.00,United States,2012,2813966,Technology,Semiconductors
ENSG,The Ensign Group Inc. Common Stock,$148.43,-0.61,-0.409%,8477386936.00,United States,2007,259563,Health Care,Hospital/Nursing Management
ENTG,Entegris Inc. Common Stock,$103.23,-0.93,-0.893%,15585498684.00,United States,2000,1741188,Industrials,Plastic Products
ENVX,Enovix Corporation Common Stock,$11.45,0.02,0.175%,2018459792.00,United States,2021,3250996,Miscellaneous,Industrial Machinery/Components
EOLS,Evolus Inc. Common Stock,$16.62,-0.01,-0.06%,1048630291.00,United States,2018,278138,Health Care,Biotechnology: Pharmaceutical Preparations
EOSE,Eos Energy Enterprises Inc. Class A Common Stock,$3.24,-0.08,-2.41%,702135210.00,United States,,4421936,Miscellaneous,Industrial Machinery/Components
EQIX,Equinix Inc. Common Stock REIT,$895.20,6.35,0.714%,84994758629.00,United States,2000,299352,Real Estate,Real Estate Investment Trusts
ERAS,Erasca Inc. Common Stock,$2.91,0.11,3.929%,822087565.00,United States,2021,1019226,Health Care,Biotechnology: Pharmaceutical Preparations
ERIC,Ericsson American Depositary Shares,$8.50,0.22,2.657%,28425289748.00,Sweden,,20938511,Technology,Radio And Television Broadcasting And Communications Equipment
ERIE,Erie Indemnity Company Class A Common Stock,$481.68,-1.37,-0.284%,22249574705.00,United States,,252990,Finance,Specialty Insurers
ERII,Energy Recovery Inc. Common Stock,$18.87,0.86,4.775%,1089270146.00,United States,2008,442474,Technology,Industrial Machinery/Components
ESEA,Euroseas Ltd. Common Stock (Marshall Islands),$43.31,0.91,2.146%,303790676.00,Greece,,42172,Consumer Discretionary,Marine Transportation
ESGR,Enstar Group Limited Ordinary Shares,$322.63,-0.76,-0.235%,4914188530.00,Bermuda,,44625,Finance,Property-Casualty Insurers
ESGRO,Enstar Group Limited Depository Shares 7.00% Perpetual Non-Cumulative Preference Shares Series E,$20.60,0.18,0.881%,313772072.00,Bermuda,,15142,Finance,Property-Casualty Insurers
ESGRP,Enstar Group Limited Depositary Shares Each Representing 1/1000th of an interest in Preference Shares,$20.57,0.17,0.833%,313315123.00,Bermuda,,117853,Finance,Property-Casualty Insurers
ESLT,Elbit Systems Ltd. Ordinary Shares,$212.27,0.02,0.009%,9414174500.00,Israel,,19157,Industrials,Military/Government/Technical
ESPR,Esperion Therapeutics Inc. Common Stock,$2.04,-0.07,-3.318%,400298378.00,United States,2013,2866079,Health Care,Biotechnology: Pharmaceutical Preparations
ESQ,Esquire Financial Holdings Inc. Common Stock,$66.45,-1.10,-1.628%,552480384.00,United States,2017,13721,Finance,Commercial Banks
ESTA,Establishment Labs Holdings Inc. Common Shares,$41.91,-0.38,-0.899%,1171113510.00,Costa Rica,2018,522012,Health Care,Industrial Specialties
ETNB,89bio Inc. Common Stock,$8.35,0.14,1.705%,884348425.00,United States,2019,489766,Health Care,Biotechnology: Pharmaceutical Preparations
ETSY,Etsy Inc. Common Stock,$51.56,0.81,1.596%,5916626526.00,United States,2015,2062112,Consumer Discretionary,Business Services
EU,enCore Energy Corp. Common Shares,$4.40,0.17,4.019%,811375968.00,United States,,2144563,Basic Materials,Other Metals and Minerals
EVCM,EverCommerce Inc. Common Stock,$10.74,0.00,0.00%,1978875792.00,United States,2021,66529,Technology,Computer Software: Prepackaged Software
EVER,EverQuote Inc. Class A Common Stock,$19.24,0.07,0.365%,675020778.00,United States,2018,624485,Technology,Computer Software: Programming Data Processing
EVGO,EVgo Inc. Class A Common Stock,$8.26,-0.08,-0.959%,2499686531.00,United States,,5365001,Technology,EDP Services
EVGOW,EVgo Inc. Warrants,$1.76,-0.03,-1.676%,532620859.00,United States,,221924,Technology,EDP Services
EVLV,Evolv Technologies Holdings Inc. Class A Common Stock,$4.30,0.04,0.939%,677465155.00,United States,2020,911857,Technology,Computer peripheral equipment
EVO,Evotec SE American Depositary Shares,$3.22,0.14,4.545%,1141076140.00,Germany,2021,94899,Health Care,Biotechnology: Pharmaceutical Preparations
EVRG,Evergy Inc. Common Stock,$61.12,0.34,0.559%,14055059608.00,United States,,1713709,Utilities,Power Generation
EWBC,East West Bancorp Inc. Common Stock,$91.83,-1.24,-1.332%,12728114965.00,United States,,998940,Finance,Major Banks
EWCZ,European Wax Center Inc. Class A Common Stock,$7.14,0.06,0.847%,428255829.00,United States,2021,325142,Consumer Discretionary,Other Consumer Services
EWTX,Edgewise Therapeutics Inc. Common Stock,$35.57,0.06,0.169%,3335480284.00,United States,2021,1314156,Health Care,Biotechnology: Pharmaceutical Preparations
EXAI,Exscientia Plc American Depositary Shares,$5.21,0.15,2.964%,654909483.00,United Kingdom,2021,509392,Health Care,Biotechnology: Biological Products (No Diagnostic Substances)
EXAS,Exact Sciences Corporation Common Stock,$71.93,2.70,3.90%,13290496174.00,United States,2001,2949188,Health Care,Medical Specialities
EXC,Exelon Corporation Common Stock,$40.95,0.18,0.442%,40970401577.00,United States,,6103515,Utilities,Power Generation
