Symbol,Name,Last Sale,Net Change,% Change,Market Cap,Country,IPO Year,Volume,Sector,Industry
HDSN,Hudson Technologies Inc. Common Stock,$8.12,0.00,0.00%,369636521.00,United States,,388498,Consumer Discretionary,Industrial Specialties
HEAR,Turtle Beach Corporation Common Stock,$17.30,0.17,0.992%,359048940.00,United States,,169154,Telecommunications,Telecommunications Equipment
HEES,H&E Equipment Services Inc. Common Stock,$51.57,-0.38,-0.731%,1883475794.00,United States,2006,311152,Industrials,Misc Corporate Leasing Services
HELE,Helen of Troy Limited Common Stock,$68.04,1.34,2.009%,1554824361.00,Bermuda,,437616,Consumer Discretionary,Home Furnishings
HEPS,D-Market Electronic Services & Trading American Depositary Shares,$3.51,1.31,59.545%,1128054000.00,Turkey,2021,43766083,Consumer Discretionary,Catalog/Specialty Distribution
HFWA,Heritage Financial Corporation Common Stock,$22.62,-0.45,-1.951%,780303976.00,United States,,106048,Finance,Banks
HIFS,Hingham Institution for Savings Common Stock,$261.15,-8.52,-3.159%,560793510.00,United States,,10959,Finance,Banks
HIMX,Himax Technologies Inc. American Depositary Shares,$6.23,-0.13,-2.044%,1088530838.00,Taiwan,2006,586409,Technology,Semiconductors
HIVE,HIVE Digital Technologies Ltd. Common Shares,$3.81,0.51,15.455%,452210264.00,Canada,,7249365,Finance,Finance: Consumer Services
HLIT,Harmonic Inc. Common Stock,$14.45,0.02,0.139%,1680924500.00,United States,1995,561763,Technology,Radio And Television Broadcasting And Communications Equipment
HLMN,Hillman Solutions Corp. Common Stock,$10.99,-0.09,-0.812%,2156453338.00,United States,2020,900022,Consumer Discretionary,Industrial Machinery/Components
HLNE,Hamilton Lane Incorporated Class A Common Stock,$180.92,-0.08,-0.044%,9805410072.00,United States,2017,232474,Finance,Investment Managers
HNRG,Hallador Energy Company Common Stock,$10.29,0.26,2.592%,438334017.00,United States,,392885,Energy,Coal Mining
HNST,The Honest Company Inc. Common Stock,$3.79,0.01,0.265%,379309431.00,United States,2021,1929461,Consumer Discretionary,Catalog/Specialty Distribution
HOLX,Hologic Inc. Common Stock,$81.57,1.10,1.367%,18946419372.00,United States,1990,1099171,Health Care,Medical Electronics
HON,Honeywell International Inc. Common Stock,$222.02,2.47,1.125%,144239999824.00,United States,,4033653,Industrials,Aerospace
HONE,HarborOne Bancorp Inc. Common Stock,$13.40,-0.09,-0.667%,595073766.00,United States,2016,175900,Finance,Major Banks
HOOD,Robinhood Markets Inc. Class A Common Stock,$26.83,0.51,1.938%,23735898425.00,United States,2021,10704926,Finance,Investment Bankers/Brokers/Service
HOPE,Hope Bancorp Inc. Common Stock,$13.24,-0.21,-1.561%,1598486741.00,United States,,438295,Finance,Major Banks
HPK,HighPeak Energy Inc. Common Stock,$14.15,-0.22,-1.531%,1802412850.00,United States,,235477,Energy,Oil & Gas Production
HPKEW,HighPeak Energy Inc. Warrant,$3.93,-0.07,-1.75%,500599470.00,United States,,100,Energy,Oil & Gas Production
HQY,HealthEquity Inc. Common Stock,$87.68,-0.32,-0.364%,7656609091.00,United States,2014,457448,Consumer Discretionary,Business Services
HRMY,Harmony Biosciences Holdings Inc. Common Stock,$35.41,0.44,1.258%,2012518320.00,United States,2020,671222,Health Care,Biotechnology: Pharmaceutical Preparations
HROW,Harrow Inc. Common Stock,$57.48,1.07,1.897%,2039559621.00,United States,,558914,Health Care,Biotechnology: Pharmaceutical Preparations
HROWL,Harrow Inc. 8.625% Senior Notes due 2026,$25.32,0.04,0.158%,898428142.00,United States,,2140,Health Care,Biotechnology: Pharmaceutical Preparations
HROWM,Harrow  Inc. 11.875% Senior Notes due 2027,$26.38,0.06,0.228%,936040063.00,United States,,1370,Health Care,Biotechnology: Pharmaceutical Preparations
HRZN,Horizon Technology Finance Corporation Common Stock,$10.19,-0.14,-1.355%,367448088.00,United States,2010,475753,Finance,Finance: Consumer Services
HSAI,Hesai Group American Depositary Share each ADS represents one Class B ordinary share,$4.47,0.08,1.822%,567817346.00,China,2023,411645,Industrials,Industrial Machinery/Components
HSIC,Henry Schein Inc. Common Stock,$72.39,0.72,1.005%,9172377570.00,United States,1995,688164,Health Care,Medical Specialities
HSII,Heidrick & Struggles International Inc. Common Stock,$38.28,-0.48,-1.238%,777749153.00,United States,1999,126208,Consumer Discretionary,Diversified Commercial Services
HST,Host Hotels & Resorts Inc. Common Stock,$17.77,-0.27,-1.497%,12482365357.00,United States,,8034430,Real Estate,Real Estate Investment Trusts
HSTM,HealthStream Inc. Common Stock,$28.84,-0.09,-0.311%,876969892.00,United States,2000,126745,Technology,Computer Software: Programming Data Processing
HTBI,HomeTrust Bancshares Inc. Common Stock,$34.35,-0.425,-1.222%,601071380.00,United States,2012,39493,Finance,Savings Institutions
HTBK,Heritage Commerce Corp Common Stock,$9.82,-0.18,-1.80%,601910458.00,United States,,247063,Finance,Major Banks
HTHT,H World Group Limited American Depositary Shares,$38.18,1.35,3.665%,12061238964.00,China,2010,1816206,Consumer Discretionary,Hotels/Resorts
HTIA,National Healthcare Properties Inc. 7.375% Series A Cumulative Redeemable Perpetual Preferred Stock,$16.6073,0.3073,1.885%,470145107.00,United States,,9233,Real Estate,Real Estate Investment Trusts
HTIBP,National Healthcare Properties Inc. 7.125% Series B Cumulative Redeemable Perpetual Preferred Stock,$15.8905,-0.1595,-0.994%,449852825.00,United States,,2445,Real Estate,Real Estate Investment Trusts
HTLD,Heartland Express Inc. Common Stock,$11.73,-0.02,-0.17%,920749400.00,United States,1986,174273,Industrials,Trucking Freight/Courier Services
HTLF,Heartland Financial USA Inc. Common Stock,$59.31,-1.36,-2.242%,2543164284.00,United States,,176332,Finance,Major Banks
HTLFP,Heartland Financial USA Inc. Depositary Shares each representing a 1/400th ownership interest in a share of 7.00% Fixed-Rate Reset Non-Cumulative Perpetual Preferred Stock Series E,$25.22,0.0219,0.087%,1081412970.00,United States,,326,Finance,Major Banks
HTZ,Hertz Global Holdings Inc Common Stock,$3.25,0.01,0.309%,996147090.00,United States,,2740145,Consumer Discretionary,Rental/Leasing Companies
HTZWW,Hertz Global Holdings Inc Warrant,$2.05,-0.03,-1.442%,628338934.00,United States,,56718,Consumer Discretionary,Rental/Leasing Companies
HUBG,Hub Group Inc. Class A Common Stock,$44.27,0.05,0.113%,2752364268.00,United States,1996,301201,Consumer Discretionary,Oil Refining/Marketing
HUMA,Humacyte Inc. Common Stock,$5.03,0.17,3.498%,600336144.00,United States,2020,5846103,Health Care,Biotechnology: Biological Products (No Diagnostic Substances)
HURA,TuHURA Biosciences Inc. Common Stock,$6.30,6.30,,350661641.00,United States,,215677,,
HURN,Huron Consulting Group Inc. Common Stock,$108.03,0.33,0.306%,1921973505.00,United States,2004,79538,Consumer Discretionary,Professional Services
HUT,Hut 8 Corp. Common Stock,$14.47,1.80,14.207%,1317912566.00,United States,,7017404,Finance,Finance: Consumer Services
HWC,Hancock Whitney Corporation Common Stock,$52.18,-1.29,-2.413%,4505559639.00,United States,,545490,Finance,Major Banks
HWCPZ,Hancock Whitney Corporation 6.25% Subordinated Notes due 2060,$25.335,0.06,0.237%,2187588223.00,United States,,2265,Finance,Major Banks
HWKN,Hawkins Inc. Common Stock,$126.55,-7.43,-5.546%,2645402592.00,United States,,140319,Consumer Discretionary,Specialty Chemicals
IAC,IAC Inc. Common Stock,$53.85,0.54,1.013%,4637743205.00,United States,,401396,Technology,Computer Software: Programming Data Processing
IART,Integra LifeSciences Holdings Corporation Common Stock,$19.87,0.11,0.557%,1541554876.00,United States,,482738,Health Care,Medical/Dental Instruments
IAS,Integral Ad Science Holding Corp. Common Stock,$10.78,0.05,0.466%,1739513935.00,United States,2021,638214,Technology,Computer Software: Programming Data Processing
IBCP,Independent Bank Corporation Common Stock,$34.12,-0.82,-2.347%,712989331.00,United States,,46353,Finance,Major Banks
IBEX,IBEX Limited Common Shares,$18.58,-0.32,-1.693%,312203419.00,Bermuda,2020,48378,Technology,EDP Services
IBKR,Interactive Brokers Group Inc. Class A Common Stock,$148.81,-0.62,-0.415%,16195847362.00,United States,2019,778664,Finance,Investment Bankers/Brokers/Service
IBOC,International Bancshares Corporation Common Stock,$64.42,-1.30,-1.978%,4006415404.00,United States,,171318,Finance,Major Banks
IBRX,ImmunityBio Inc. Common Stock,$3.55,0.11,3.198%,2472693634.00,United States,2015,1397063,Health Care,Biotechnology: Biological Products (No Diagnostic Substances)
IBTX,Independent Bank Group Inc Common Stock,$60.58,-0.90,-1.464%,2510569203.00,United States,2013,112437,Finance,Major Banks
ICFI,ICF International Inc. Common Stock,$173.25,-1.80,-1.028%,3249654062.00,United States,2006,75147,Consumer Discretionary,Professional Services
ICHR,Ichor Holdings Ordinary Shares,$28.51,0.01,0.035%,960440518.00,United States,2016,217022,Technology,Semiconductors
ICLR,ICON plc Ordinary Shares,$297.72,2.48,0.84%,24560437004.00,Ireland,1998,506622,Health Care,Biotechnology: Commercial Physical & Biological Resarch
ICUI,ICU Medical Inc. Common Stock,$180.94,0.43,0.238%,4419509982.00,United States,1992,178457,Health Care,Medical/Dental Instruments
IDCC,InterDigital Inc. Common Stock,$154.17,-1.52,-0.976%,3874255716.00,United States,,233919,Miscellaneous,Multi-Sector Companies
IDXX,IDEXX Laboratories Inc. Common Stock,$457.74,-2.27,-0.493%,37674701751.00,United States,1991,747278,Health Care,Biotechnology: In Vitro & In Vivo Diagnostic Substances
IDYA,IDEAYA Biosciences Inc. Common Stock,$30.54,-0.15,-0.489%,2580064827.00,United States,2019,790812,Health Care,Biotechnology: Pharmaceutical Preparations
IEP,Icahn Enterprises L.P. Common Stock,$14.92,0.11,0.743%,7093907393.00,United States,,1506980,Consumer Discretionary,Auto Parts:O.E.M.
IESC,IES Holdings Inc. Common Stock,$228.86,-1.04,-0.452%,4572212912.00,United States,,75958,Industrials,Engineering & Construction
IGIC,International General Insurance Holdings Ltd. Ordinary Share,$19.15,-0.20,-1.034%,882320528.00,Jordan,2018,27554,Finance,Property-Casualty Insurers
IGMS,IGM Biosciences Inc. Common Stock,$16.72,0.69,4.304%,991808146.00,United States,2019,206415,Health Care,Biotechnology: Pharmaceutical Preparations
IIIV,i3 Verticals Inc. Class A Common Stock,$22.88,0.02,0.087%,773088499.00,United States,2018,112344,Consumer Discretionary,Business Services
ILMN,Illumina Inc. Common Stock,$146.07,2.55,1.777%,23268951000.00,United States,2000,1745883,Health Care,Medical Specialities
IMCR,Immunocore Holdings plc American Depositary Shares,$34.38,0.63,1.867%,1653277335.00,United Kingdom,2021,218315,Health Care,Biotechnology: Biological Products (No Diagnostic Substances)
IMKTA,Ingles Markets Incorporated Class A Common Stock,$63.72,-0.52,-0.809%,1210321639.00,United States,1987,162192,Consumer Staples,Food Chains
IMMP,Immutep Limited American Depositary Shares,$1.99,0.00,0.00%,2362739356.00,Australia,,63766,Health Care,Biotechnology: Pharmaceutical Preparations
IMNM,Immunome Inc. Common Stock,$12.28,0.19,1.572%,737467688.00,United States,2020,396047,Health Care,Biotechnology: Pharmaceutical Preparations
IMOS,ChipMOS TECHNOLOGIES INC. American Depositary Shares,$22.51,-0.13,-0.574%,818508755.00,Taiwan,,9161,Technology,Semiconductors
IMPPP,Imperial Petroleum Inc. 8.75% Series A Cumulative Redeemable Perpetual Preferred Shares,$25.05,-0.10,-0.398%,844936500.00,Greece,,718,Consumer Discretionary,Marine Transportation
IMTX,Immatics N.V. Ordinary Shares,$9.88,0.33,3.455%,1018726800.00,Germany,,444718,Health Care,Biotechnology: Biological Products (No Diagnostic Substances)
IMVT,Immunovant Inc. Common Stock,$29.47,0.21,0.718%,4313446512.00,United States,2019,509990,Health Care,Biotechnology: Biological Products (No Diagnostic Substances)
IMXI,International Money Express Inc. Common Stock,$18.17,-0.20,-1.089%,592484307.00,United States,2017,138298,Consumer Discretionary,Business Services
INBK,First Internet Bancorp Common Stock,$37.28,-0.93,-2.434%,323139088.00,United States,,30493,Finance,Major Banks
INCY,Incyte Corp. Common Stock,$66.39,-0.04,-0.06%,12786583013.00,United States,,742308,Health Care,Biotechnology: Commercial Physical & Biological Resarch
INDB,Independent Bank Corp. Common Stock,$61.57,-3.52,-5.408%,2615685267.00,United States,,588907,Finance,Major Banks
INDI,indie Semiconductor Inc. Class A Common Stock,$3.67,0.11,3.09%,724517557.00,United States,,2464101,Technology,Semiconductors
INDV,Indivior PLC Ordinary Shares,$8.56,-0.03,-0.349%,1109163755.00,United Kingdom,,325470,Health Care,Biotechnology: Pharmaceutical Preparations
INFN,Infinera Corporation Common Stock,$6.87,0.15,2.232%,1619008561.00,United States,2007,1785020,Utilities,Telecommunications Equipment
INMD,InMode Ltd. Ordinary Shares,$17.78,0.57,3.312%,1493208174.00,Israel,2019,1114847,Health Care,Biotechnology: Electromedical & Electrotherapeutic Apparatus
INNV,InnovAge Holding Corp. Common Stock,$6.02,0.05,0.838%,816435657.00,United States,2021,19742,Health Care,Medical/Nursing Services
INOD,Innodata Inc. Common Stock,$18.80,0.47,2.564%,544990211.00,United States,1993,615330,Technology,EDP Services
INSM,Insmed Incorporated Common Stock,$74.54,0.27,0.364%,12809632138.00,United States,,906245,Health Care,Biotechnology: Pharmaceutical Preparations
INTA,Intapp Inc. Common Stock,$50.06,0.28,0.562%,3739458372.00,United States,2021,830408,Technology,Computer Software: Prepackaged Software
INTC,Intel Corporation Common Stock,$22.77,0.33,1.471%,97364520000.00,United States,,39916460,Technology,Semiconductors
INTR,Inter & Co. Inc. Class A Common Shares,$6.59,0.01,0.152%,2891951633.00,Brazil,,1256836,Finance,Commercial Banks
INTU,Intuit Inc. Common Stock,$613.29,4.06,0.666%,171900280680.00,United States,1993,1299475,Technology,Computer Software: Prepackaged Software
INV,Innventure Inc. Common Stock,$12.58,0.31,2.526%,561100997.00,United States,,16897,Finance,Blank Checks
INVA,Innoviva Inc. Common Stock,$20.03,-0.14,-0.694%,1253126775.00,United States,2004,215950,Health Care,Biotechnology: Pharmaceutical Preparations
INZY,Inozyme Pharma Inc. Common Stock,$5.54,0.39,7.573%,371734000.00,United States,2020,206862,Health Care,Biotechnology: Pharmaceutical Preparations
IONR,ioneer Ltd American Depositary Shares,$7.325,0.745,11.322%,384346098.00,Australia,,32039,Industrials,Mining & Quarrying of Nonmetallic Minerals (No Fuels)
IONS,Ionis Pharmaceuticals Inc. Common Stock,$39.68,1.19,3.092%,5801656091.00,United States,,1342749,Health Care,Biotechnology: Pharmaceutical Preparations
IOSP,Innospec Inc. Common Stock,$113.31,-2.43,-2.10%,2826112414.00,United States,,80842,Industrials,Major Chemicals
IOVA,Iovance Biotherapeutics Inc. Common Stock,$10.24,0.07,0.688%,3107982049.00,United States,,8876688,Health Care,Biotechnology: Biological Products (No Diagnostic Substances)
IPAR,Interparfums Inc. Common Stock,$120.62,0.22,0.183%,3862768654.00,United States,,114809,Consumer Discretionary,Package Goods/Cosmetics
IPGP,IPG Photonics Corporation Common Stock,$75.59,0.24,0.319%,3343052033.00,United States,2006,206635,Technology,Semiconductors
IQ,iQIYI Inc. American Depositary Shares,$2.42,0.06,2.542%,2321864535.00,China,2018,15139382,Consumer Discretionary,Consumer Electronics/Video Chains
IRDM,Iridium Communications Inc Common Stock,$31.60,-1.97,-5.868%,3740892056.00,United States,,2030052,Telecommunications,Telecommunications Equipment
IREN,Iris Energy Limited Ordinary Shares,$9.49,0.54,6.034%,1796894290.00,Australia,2021,18349955,Technology,EDP Services
IRMD,iRadimed Corporation Common Stock,$51.81,0.27,0.524%,656421664.00,United States,2014,21884,Health Care,Medical/Dental Instruments
IRON,Disc Medicine Inc. Common Stock,$50.56,0.07,0.139%,1502934577.00,United States,,352000,Health Care,Biotechnology: Pharmaceutical Preparations
IRTC,iRhythm Technologies Inc. Common Stock,$62.67,0.18,0.288%,1957564820.00,United States,2016,347282,Health Care,Medical/Dental Instruments
IRWD,Ironwood Pharmaceuticals Inc. Class A Common Stock,$4.40,-0.04,-0.901%,702851604.00,United States,2010,905785,Health Care,Biotechnology: Pharmaceutical Preparations
ISPR,Ispire Technology Inc. Common Stock,$6.75,-0.14,-2.032%,382327027.00,United States,2023,268103,Health Care, Medicinal Chemicals and Botanical Products 
ISRG,Intuitive Surgical Inc. Common Stock,$521.15,47.42,10.01%,185192828822.00,United States,2000,4056320,Health Care,Industrial Specialties
ITCI,Intra-Cellular Therapies Inc. Common Stock,$78.34,-0.34,-0.432%,8277946905.00,United States,,505832,Health Care,Biotechnology: Pharmaceutical Preparations
ITI,Iteris Inc. Common Stock,$7.18,0.00,0.00%,307467876.00,United States,,222474,Telecommunications,Telecommunications Equipment
ITIC,Investors Title Company Common Stock,$236.54,-6.16,-2.538%,445612266.00,United States,,4447,Finance,Specialty Insurers
ITOS,iTeos Therapeutics Inc. Common Stock,$9.43,-0.18,-1.873%,344400998.00,United States,2020,1726154,Health Care,Biotechnology: Biological Products (No Diagnostic Substances)
ITRI,Itron Inc. Common Stock,$104.19,-0.81,-0.771%,4684674028.00,United States,1993,511240,Industrials,Electrical Products
ITRN,Ituran Location and Control Ltd. Ordinary Shares,$27.75,0.27,0.983%,552046845.00,Israel,2005,59846,Technology,Electronic Components
IVCP,Swiftmerge Acquisition Corp. Class A Ordinary Share,$11.06,0.00,0.00%,311062500.00,United States,2022,1,Finance,Blank Checks
JACK,Jack In The Box Inc. Common Stock,$45.78,-0.53,-1.144%,875587410.00,United States,,558843,Consumer Discretionary,Restaurants
JAMF,Jamf Holding Corp. Common Stock,$16.53,0.06,0.364%,2109912144.00,United States,2020,284031,Technology,Computer Software: Prepackaged Software
JANX,Janux Therapeutics Inc. Common Stock,$50.03,0.22,0.442%,2609789835.00,United States,2021,832334,Health Care,Biotechnology: Pharmaceutical Preparations
JAZZ,Jazz Pharmaceuticals plc Common Stock (Ireland),$115.04,0.41,0.358%,7104123790.00,Ireland,2007,391177,Health Care,Biotechnology: Pharmaceutical Preparations
JBHT,J.B. Hunt Transport Services Inc. Common Stock,$176.87,3.39,1.954%,18038357738.00,United States,,1003859,Industrials,Trucking Freight/Courier Services
JBLU,JetBlue Airways Corporation Common Stock,$8.05,0.64,8.637%,2792006672.00,United States,2002,20284156,Consumer Discretionary,Air Freight/Delivery Services
JBSS,John B. Sanfilippo & Son Inc. Common Stock,$96.21,-0.83,-0.855%,1116369271.00,United States,1991,46248,Consumer Staples,Specialty Foods
JD,JD.com Inc. American Depositary Shares,$39.98,1.13,2.909%,62853280998.00,China,2014,15201275,Consumer Discretionary,Other Specialty Stores
JFIN,Jiayin Group Inc. American Depositary Shares,$7.17,0.44,6.538%,380242925.00,China,2019,92468,Finance,Finance: Consumer Services
JJSF,J & J Snack Foods Corp. Common Stock,$168.58,0.04,0.024%,3274450886.00,United States,1986,119653,Consumer Staples,Specialty Foods
JKHY,Jack Henry & Associates Inc. Common Stock,$186.12,0.14,0.075%,13569696332.00,United States,1985,304180,Technology,EDP Services
JMSB,John Marshall Bancorp Inc. Common Stock,$21.10,-0.17,-0.799%,300276273.00,United States,,12611,Finance,Major Banks
JOUT,Johnson Outdoors Inc. Class A Common Stock,$34.61,-0.06,-0.173%,356635007.00,United States,,19623,Consumer Discretionary,Recreational Games/Products/Toys
JSM,Navient Corporation 6% Senior Notes due December 15 2043,$20.45,-0.03,-0.146%,2237436422.00,United States,,3501,Finance,Finance: Consumer Services
JSPR,Jasper Therapeutics Inc. Common Stock,$20.04,0.21,1.059%,302710212.00,United States,2020,645563,Health Care,Biotechnology: Biological Products (No Diagnostic Substances)
KALU,Kaiser Aluminum Corporation Common Stock,$73.42,-0.35,-0.474%,1181115763.00,United States,,151576,Industrials,Metal Fabrications
KALV,KalVista Pharmaceuticals Inc. Common Stock,$12.50,0.41,3.391%,540193400.00,United Kingdom,2015,119396,Health Care,Biotechnology: Pharmaceutical Preparations
KARO,Karooooo Ltd. Ordinary Shares,$40.00,0.04,0.10%,1236000000.00,Singapore,2021,25736,Technology,Computer Software: Prepackaged Software
KC,Kingsoft Cloud Holdings Limited American Depositary Shares,$2.78,0.10,3.731%,705246115.00,China,2020,2275988,Technology,Computer Software: Prepackaged Software
KDP,Keurig Dr Pepper Inc. Common Stock,$36.94,0.44,1.205%,50093830766.00,United States,,9535638,Consumer Staples,Beverages (Production/Distribution)
KE,Kimball Electronics Inc. Common Stock,$18.45,-0.37,-1.966%,456330455.00,United States,,94874,Technology,Electrical Products
KELYA,Kelly Services Inc. Class A Common Stock,$20.17,-0.48,-2.324%,717413539.00,United States,,126326,Consumer Discretionary,Professional Services
KELYB,Kelly Services Inc. Class B Common Stock,$20.60,0.00,0.00%,732707928.00,United States,,13,Consumer Discretionary,Professional Services
KHC,The Kraft Heinz Company Common Stock,$36.00,0.05,0.139%,43526840292.00,United States,,5503680,Consumer Staples,Packaged Foods
KIDS,OrthoPediatrics Corp. Common Stock,$27.56,0.70,2.606%,667349581.00,United States,2017,85105,Health Care,Medical/Dental Instruments
KLAC,KLA Corporation Common Stock,$678.52,8.27,1.234%,91210065927.00,United States,1980,1192419,Technology,Electronic Components
KLIC,Kulicke and Soffa Industries Inc. Common Stock,$44.55,-0.63,-1.394%,2428388335.00,Singapore,,518854,Technology,Semiconductors
KNSA,Kiniksa Pharmaceuticals International plc Class A Ordinary Shares,$26.26,-0.49,-1.832%,1870859877.00,United States,2018,162032,Health Care,Biotechnology: Pharmaceutical Preparations
KRNT,Kornit Digital Ltd. Ordinary Shares,$24.51,-0.17,-0.689%,1169608205.00,Israel,2015,100899,Industrials,Industrial Machinery/Components
KRNY,Kearny Financial Corp Common Stock,$7.39,-0.13,-1.729%,477243857.00,United States,2005,260859,Finance,Savings Institutions
KROS,Keros Therapeutics Inc. Common Stock,$61.25,0.16,0.262%,2298228441.00,United States,2020,340419,Health Care,Biotechnology: Pharmaceutical Preparations
KRRO,Korro Bio Inc. Common Stock,$80.04,0.03,0.037%,744277153.00,United States,2019,160650,Health Care,Biotechnology: Pharmaceutical Preparations
KRT,Karat Packaging Inc. Common Stock,$27.59,-0.17,-0.612%,552204607.00,United States,2021,42451,Industrials,Plastic Products
KRUS,Kura Sushi USA Inc. Class A Common Stock,$90.51,2.53,2.876%,1017779791.00,United States,2019,152092,Consumer Discretionary,Restaurants
KRYS,Krystal Biotech Inc. Common Stock,$179.19,2.37,1.34%,5148119741.00,United States,2017,189815,Health Care,Biotechnology: Biological Products (No Diagnostic Substances)
KSPI,Joint Stock Company Kaspi.kz American Depository Shares,$115.20,8.32,7.784%,21811215168.00,Kazakhstan,2024,551420,,
KTOS,Kratos Defense & Security Solutions Inc. Common Stock,$24.85,-0.37,-1.467%,3752332605.00,United States,,576743,Industrials,Military/Government/Technical
KURA,Kura Oncology Inc. Common Stock,$18.00,-0.09,-0.498%,1379420928.00,United States,,251305,Health Care,Biotechnology: Pharmaceutical Preparations
KYMR,Kymera Therapeutics Inc. Common Stock,$46.41,0.16,0.346%,2865968008.00,United States,2020,222933,Health Care,Biotechnology: Biological Products (No Diagnostic Substances)
LAB,Standard BioTools Inc. Common Stock,$1.90,0.10,5.556%,705193495.00,United States,2011,954655,Industrials,Biotechnology: Laboratory Analytical Instruments
LAMR,Lamar Advertising Company Class A Common Stock,$136.15,0.19,0.14%,13928367333.00,United States,1996,286316,Real Estate,Real Estate Investment Trusts
LANC,Lancaster Colony Corporation Common Stock,$175.78,-2.64,-1.48%,4838696060.00,United States,,96611,Consumer Staples,Packaged Foods
LAND,Gladstone Land Corporation Common Stock,$13.50,-0.04,-0.295%,483818967.00,United States,1993,140080,Real Estate,Real Estate Investment Trusts
LANDM,Gladstone Land Corporation 5.00% Series D Cumulative Term Preferred Stock,$24.52,0.00,0.00%,878758598.00,United States,,8252,Real Estate,Real Estate Investment Trusts
LANDO,Gladstone Land Corporation 6.00% Series B Cumulative Redeemable Preferred Stock,$22.11,0.06,0.272%,792387953.00,United States,,13927,Real Estate,Real Estate Investment Trusts
LANDP,Gladstone Land Corporation 6.00% Series C Cumulative Redeemable Preferred Stock,$21.56,-0.045,-0.208%,772676810.00,United States,,16851,Real Estate,Real Estate Investment Trusts
LASR,nLIGHT Inc. Common Stock,$11.02,-0.21,-1.87%,530344784.00,United States,2018,183271,Technology,Semiconductors
LAUR,Laureate Education Inc. Common Stock,$15.83,0.11,0.70%,2414799507.00,United States,2017,457041,Real Estate,Other Consumer Services
LAZR,Luminar Technologies Inc.  Class A Common Stock,$0.8394,0.0149,1.807%,414462595.00,United States,2019,20329492,Consumer Discretionary,Auto Parts:O.E.M.
LBPH,Longboard Pharmaceuticals Inc. Common Stock,$59.21,0.04,0.068%,2303240638.00,United States,2021,3285066,Health Care,Biotechnology: Pharmaceutical Preparations
LBRDA,Liberty Broadband Corporation Class A Common Stock,$79.23,-0.38,-0.477%,11317844584.00,United States,,87396,Telecommunications,Cable & Other Pay Television Services
LBRDK,Liberty Broadband Corporation Class C Common Stock,$79.70,-0.36,-0.45%,11384983129.00,United States,,739795,Telecommunications,Cable & Other Pay Television Services
LBRDP,Liberty Broadband Corporation Series A Cumulative Redeemable Preferred Stock,$24.15,0.21,0.877%,3449778451.00,United States,,3474,Telecommunications,Cable & Other Pay Television Services
LBTYA,Liberty Global Ltd. Class A Common Shares,$20.93,-0.22,-1.04%,7648760941.00,United Kingdom,,1348562,Telecommunications,Cable & Other Pay Television Services
LBTYB,Liberty Global Ltd. Class B Common Shares,$21.60,0.00,0.00%,7893608998.00,United Kingdom,,65,Telecommunications,Cable & Other Pay Television Services
LBTYK,Liberty Global Ltd. Class C Common Shares,$21.72,-0.20,-0.912%,7937462381.00,United Kingdom,,742635,Telecommunications,Cable & Other Pay Television Services
