Symbol,Name,Last Sale,Net Change,% Change,Market Cap,Country,IPO Year,Volume,Sector,Industry
PRQR,ProQR Therapeutics N.V. Ordinary Shares,$4.33,-0.16,-3.563%,352265383.00,Netherlands,2014,2152575,Health Care,Biotechnology: Pharmaceutical Preparations
PRTA,Prothena Corporation plc Ordinary Shares,$17.11,0.05,0.293%,920181703.00,United States,,246531,Health Care,Biotechnology: Pharmaceutical Preparations
PRTC,PureTech Health plc American Depositary Shares,$19.9399,-0.1901,-0.944%,477403698.00,United States,,6472,Health Care,Biotechnology: Pharmaceutical Preparations
PRTH,Priority Technology Holdings Inc. Common Stock,$6.29,-0.19,-2.932%,483271072.00,United States,2016,18495,Consumer Discretionary,Business Services
PRVA,Privia Health Group Inc. Common Stock,$17.83,-0.61,-3.308%,2131843451.00,United States,2021,625955,Health Care,Medical/Nursing Services
PSEC,Prospect Capital Corporation Common Stock,$5.30,0.02,0.379%,2273637550.00,United States,2004,1548344,Finance,Finance: Consumer Services
PSMT,PriceSmart Inc. Common Stock,$92.96,-0.28,-0.30%,2848200789.00,United States,,88565,Consumer Discretionary,Department/Specialty Retail Stores
PSNL,Personalis Inc. Common Stock,$4.87,0.25,5.411%,321030400.00,United States,2019,366528,Health Care,Medical Specialities
PSNY,Polestar Automotive Holding UK PLC Class A ADS,$1.28,0.05,4.065%,2733069169.00,Sweden,,2291392,Consumer Discretionary,Auto Manufacturing
PSNYW,Polestar Automotive Holding UK PLC Class C-1 ADS (ADW),$0.2243,0.0137,6.505%,478927668.00,Sweden,,46851,Consumer Discretionary,Auto Manufacturing
PTC,PTC Inc. Common Stock,$184.40,-0.82,-0.443%,22152936596.00,United States,,424488,Technology,Computer Software: Prepackaged Software
PTCT,PTC Therapeutics Inc. Common Stock,$39.10,2.09,5.647%,3007735047.00,United States,2013,572077,Health Care,Biotechnology: Pharmaceutical Preparations
PTEN,Patterson-UTI Energy Inc. Common Stock,$7.98,0.01,0.125%,3136537444.00,United States,1993,13755026,Energy,Oil & Gas Production
PTGX,Protagonist Therapeutics Inc. Common Stock,$46.97,-0.05,-0.106%,2766748357.00,United States,2016,588702,Health Care,Biotechnology: Pharmaceutical Preparations
PTLO,Portillo's Inc. Class A Common Stock,$12.38,-0.07,-0.562%,765017420.00,United States,2021,919533,Consumer Discretionary,Restaurants
PTON,Peloton Interactive Inc. Class A Common Stock,$5.84,0.57,10.816%,2198289354.00,United States,2019,29858963,Consumer Discretionary,Recreational Games/Products/Toys
PTSI,P.A.M. Transportation Services Inc. Common Stock,$16.82,-0.50,-2.887%,365919285.00,United States,1986,18279,Industrials,Trucking Freight/Courier Services
PTVE,Pactiv Evergreen Inc. Common stock,$12.10,-0.20,-1.626%,2168981108.00,United States,2020,188514,Consumer Discretionary,Containers/Packaging
PUBM,PubMatic Inc. Class A Common Stock,$15.29,-0.01,-0.065%,758141057.00,United States,2020,249413,Technology,Computer Software: Programming Data Processing
PWP,Perella Weinberg Partners Class A Common Stock,$22.18,0.06,0.271%,1903913855.00,United States,2020,211346,Finance,Finance: Consumer Services
PYCR,Paycor HCM Inc. Common Stock,$14.36,0.21,1.484%,2567885571.00,United States,2021,586789,Technology,Computer Software: Prepackaged Software
PYPL,PayPal Holdings Inc. Common Stock,$80.94,1.12,1.403%,82747664829.00,United States,,8839767,Consumer Discretionary,Business Services
PZZA,Papa John's International Inc. Common Stock,$54.56,-0.43,-0.782%,1780068340.00,United States,1993,1012478,Consumer Discretionary,Restaurants
QCOM,QUALCOMM Incorporated Common Stock,$170.92,-0.18,-0.105%,190404880000.00,United States,1991,6431467,Technology,Radio And Television Broadcasting And Communications Equipment
QCRH,QCR Holdings Inc. Common Stock,$80.79,-0.93,-1.138%,1360658959.00,United States,,59229,Finance,Major Banks
QDEL,QuidelOrtho Corporation Common Stock,$40.83,0.76,1.897%,2745221137.00,United States,,601368,Health Care,Biotechnology: In Vitro & In Vivo Diagnostic Substances
QFIN,Qifu Technology Inc. American Depositary Shares,$33.37,1.34,4.184%,5180841831.00,China,2018,1556188,Finance,Finance: Consumer Services
QLYS,Qualys Inc. Common Stock,$123.21,-1.22,-0.98%,4535485528.00,United States,2012,566191,Technology,Computer Software: Prepackaged Software
QNST,QuinStreet Inc. Common Stock,$19.20,-0.03,-0.156%,1074741005.00,United States,2010,206071,Consumer Discretionary,Business Services
QRTEB,Qurate Retail Inc. Series B Common Stock ,$3.66,-0.15,-3.937%,1452732858.00,United States,,6492,Consumer Discretionary,Catalog/Specialty Distribution
QRTEP,Qurate Retail Inc. 8.0% Fixed Rate Cumulative Redeemable Preferred Stock,$40.76,0.06,0.147%,16178522215.00,United States,,24158,Consumer Discretionary,Catalog/Specialty Distribution
QRVO,Qorvo Inc. Common Stock,$104.50,0.22,0.211%,9913010657.00,United States,,751903,Technology,Semiconductors
QTRX,Quanterix Corporation Common Stock,$12.78,0.37,2.981%,490484042.00,United States,2017,221776,Industrials,Biotechnology: Laboratory Analytical Instruments
QTTB,Q32 Bio Inc. Common Stock,$48.78,-0.86,-1.732%,588276361.00,United States,2018,59698,Health Care,Biotechnology: Pharmaceutical Preparations
QURE,uniQure N.V. Ordinary Shares,$6.42,0.14,2.229%,312638714.00,Netherlands,2014,659763,Health Care,Biotechnology: Pharmaceutical Preparations
QXO,QXO Inc. Common Stock,$15.40,-0.02,-0.13%,6305225003.00,United States,,752194,Technology,EDP Services
RAPP,Rapport Therapeutics Inc. Common Stock,$25.95,-2.10,-7.487%,949159059.00,United States,2024,115523,Health Care,Biotechnology: Pharmaceutical Preparations
RARE,Ultragenyx Pharmaceutical Inc. Common Stock,$56.26,-0.51,-0.898%,5185213589.00,United States,2014,310163,Health Care,Biotechnology: Pharmaceutical Preparations
RBB,RBB Bancorp Common Stock,$23.94,-0.49,-2.006%,426246625.00,United States,2017,33483,Finance,Major Banks
RBBN,Ribbon Communications Inc. Common Stock,$3.41,-0.15,-4.213%,595135692.00,United States,,272460,Technology,EDP Services
RBCAA,Republic Bancorp Inc. Class A Common Stock,$69.10,1.35,1.993%,1342894583.00,United States,1998,26268,Finance,Major Banks
RCKT,Rocket Pharmaceuticals Inc. Common Stock,$18.82,0.39,2.116%,1712165666.00,United States,2015,529843,Health Care,Biotechnology: Pharmaceutical Preparations
RCM,R1 RCM Inc. Common Stock,$14.25,0.02,0.141%,6015052723.00,United States,,2381337,Consumer Discretionary,Other Consumer Services
RDFN,Redfin Corporation Common Stock,$11.23,0.69,6.546%,1367524940.00,United States,2017,6129458,Finance,Real Estate
RDNT,RadNet Inc. Common Stock,$68.16,-0.20,-0.293%,5040926842.00,United States,,447656,Health Care,Medical Specialities
RDUS,Radius Recycling Inc. Class A Common Stock,$18.11,-0.39,-2.108%,507794512.00,United States,,135210,Consumer Discretionary,Industrial Specialties
RDVT,Red Violet Inc. Common Stock ,$30.97,2.18,7.572%,425265051.00,United States,,143806,Technology,Computer Software: Prepackaged Software
RDWR,Radware Ltd. Ordinary Shares,$23.24,0.21,0.912%,969081878.00,Israel,1999,628311,Consumer Discretionary,Business Services
REAL,The RealReal Inc. Common Stock,$3.05,-0.13,-4.088%,330919525.00,United States,2019,1441977,Consumer Discretionary,Other Specialty Stores
REAX,The Real Brokerage Inc. Common Shares,$5.14,-0.06,-1.154%,1004356000.00,Canada,,542446,Finance,Real Estate
REFI,Chicago Atlantic Real Estate Finance Inc. Common Stock,$15.60,-0.11,-0.70%,306141545.00,United States,2021,43090,Real Estate,Real Estate Investment Trusts
REG,Regency Centers Corporation Common Stock,$72.57,0.57,0.792%,13171215084.00,United States,1993,759743,Real Estate,Real Estate Investment Trusts
REGCO,Regency Centers Corporation 5.875% Series B Cumulative Redeemable Preferred Stock,$24.17,-0.08,-0.33%,4386775094.00,United States,,1177,Real Estate,Real Estate Investment Trusts
REGCP,Regency Centers Corporation 6.25% Series A Cumulative Redeemable Preferred Stock,$24.77,-0.03,-0.121%,4495673110.00,United States,,447,Real Estate,Real Estate Investment Trusts
REGN,Regeneron Pharmaceuticals Inc. Common Stock,$990.68,-7.55,-0.756%,109207143190.00,United States,1991,869173,Health Care,Biotechnology: Pharmaceutical Preparations
RELY,Remitly Global Inc. Common Stock,$14.99,0.57,3.953%,2925096765.00,United States,2021,1401268,Consumer Discretionary,Business Services
REPL,Replimune Group Inc. Common Stock,$11.53,0.22,1.945%,787745696.00,United States,2018,316491,Health Care,Biotechnology: Biological Products (No Diagnostic Substances)
REYN,Reynolds Consumer Products Inc. Common Stock,$30.22,-0.24,-0.788%,6350380061.00,United States,2020,334405,Consumer Discretionary,Containers/Packaging
RGEN,Repligen Corporation Common Stock,$146.95,4.81,3.384%,8230154881.00,United States,1986,658519,Health Care,Biotechnology: Biological Products (No Diagnostic Substances)
RGLD,Royal Gold Inc. Common Stock,$152.65,4.20,2.829%,10035341668.00,United States,,476405,Industrials,Precious Metals
RGNX,REGENXBIO Inc. Common Stock,$11.10,0.50,4.717%,548597387.00,United States,2015,436995,Health Care,Biotechnology: Biological Products (No Diagnostic Substances)
RICK,RCI Hospitality Holdings Inc. Common Stock,$44.02,-0.46,-1.034%,396027955.00,United States,1995,57974,Consumer Discretionary,Restaurants
RILYG,B. Riley Financial Inc. 5.00% Senior Notes due 2026,$11.50,0.26,2.313%,348395985.00,United States,,18484,Finance,Investment Managers
RILYK,B. Riley Financial Inc. 5.50% Senior Notes Due 2026,$17.80,0.44,2.535%,539256393.00,United States,,15848,Finance,Investment Managers
RILYM,B. Riley Financial Inc. 6.375% Senior Notes due 2025,$23.85,0.35,1.489%,722542977.00,United States,,220128,Finance,Investment Managers
RILYN,B. Riley Financial Inc. 6.50% Senior Notes Due 2026,$12.47,0.42,3.485%,377782428.00,United States,,94192,Finance,Investment Managers
RILYT,B. Riley Financial Inc. 6.00% Senior Notes Due 2028,$10.81,0.59,5.773%,327492225.00,United States,,35241,Finance,Investment Managers
RIOT,Riot Platforms Inc. Common Stock ,$9.86,0.66,7.174%,2992747301.00,United States,,23116696,Finance,Finance: Consumer Services
RITR,Reitar Logtech Holdings Limited Ordinary shares,$5.99,0.68,12.806%,491928750.00,Hong Kong,2024,161858,Finance,Real Estate
RIVN,Rivian Automotive Inc. Class A Common Stock,$10.04,-0.08,-0.791%,10123067346.00,United States,2021,18401904,Consumer Discretionary,Auto Manufacturing
RKLB,Rocket Lab USA Inc. Common Stock,$10.81,0.13,1.217%,5368679967.00,United States,2020,10070147,Industrials,Military/Government/Technical
RLAY,Relay Therapeutics Inc. Common Stock,$6.73,0.09,1.355%,901079471.00,United States,2020,909348,Health Care,Biotechnology: Biological Products (No Diagnostic Substances)
RMBS,Rambus Inc. Common Stock,$41.18,-1.52,-3.56%,4434269565.00,United States,1997,1154421,Technology,Semiconductors
RMR,The RMR Group Inc. Class A Common Stock,$25.30,-0.23,-0.901%,802637516.00,United States,,63897,Consumer Discretionary,Professional Services
RNA,Avidity Biosciences Inc. Common Stock,$50.45,1.93,3.978%,5964199000.00,United States,2020,1211842,Health Care,Biotechnology: Pharmaceutical Preparations
RNAC,Cartesian Therapeutics Inc. Common Stock,$22.87,1.17,5.392%,489017432.00,United States,2016,50075,Health Care,Biotechnology: Pharmaceutical Preparations
RNW,ReNew Energy Global plc Class A Ordinary Shares,$6.07,0.06,0.998%,488995983.00,United Kingdom,,1235561,Utilities,Electric Utilities: Central
ROAD,Construction Partners Inc. Class A Common Stock,$74.70,-0.73,-0.968%,3941300783.00,United States,2018,226409,Industrials,Military/Government/Technical
ROCK,Gibraltar Industries Inc. Common Stock,$67.61,0.43,0.64%,2060687692.00,United States,1993,170712,Industrials,Steel/Iron Ore
ROIC,Retail Opportunity Investments Corp. Common Stock (MD),$16.16,0.09,0.56%,2059662361.00,United States,,555964,Real Estate,Real Estate Investment Trusts
ROIV,Roivant Sciences Ltd. Common Shares,$11.92,0.01,0.084%,8815100142.00,United Kingdom,,2998726,Health Care,Biotechnology: Pharmaceutical Preparations
ROKU,Roku Inc. Class A Common Stock,$80.07,3.12,4.055%,11585223248.00,United States,2017,2867966,Telecommunications,Cable & Other Pay Television Services
ROOT,Root Inc. Class A Common Stock,$40.15,-1.92,-4.564%,602250000.00,United States,2020,165146,Finance,Property-Casualty Insurers
ROP,Roper Technologies Inc. Common Stock,$557.62,-6.12,-1.086%,59776119577.00,United States,1992,320466,Industrials,Industrial Machinery/Components
ROST,Ross Stores Inc. Common Stock,$149.90,0.71,0.476%,49731199350.00,United States,1985,4003381,Consumer Discretionary,Clothing/Shoe/Accessory Stores
RPAY,Repay Holdings Corporation Class A Common Stock,$7.86,0.08,1.028%,768300483.00,United States,2018,332559,Consumer Discretionary,Business Services
RPD,Rapid7 Inc. Common Stock,$39.80,-0.39,-0.97%,2496819449.00,United States,2015,502305,Technology,Computer Software: Prepackaged Software
RPRX,Royalty Pharma plc Class A Ordinary Shares ,$27.98,-0.07,-0.25%,16604986961.00,United States,2020,1177560,Health Care,Biotechnology: Pharmaceutical Preparations
RRBI,Red River Bancshares Inc. Common Stock,$52.30,-0.38,-0.721%,360156262.00,United States,2019,5553,Consumer Discretionary,Hotels/Resorts
RRR,Red Rock Resorts Inc. Class A Common Stock,$52.26,-0.33,-0.627%,5518897859.00,United States,2016,372015,Consumer Discretionary,Hotels/Resorts
RSVR,Reservoir Media Inc. Common Stock,$8.85,-0.08,-0.896%,575948601.00,United States,2021,14261,Consumer Discretionary,Services-Misc. Amusement & Recreation
RUM,Rumble Inc. Class A Common Stock,$5.71,0.03,0.528%,2221266097.00,United States,2021,1232498,Technology,Computer Software: Programming Data Processing
RUMBW,Rumble Inc. Warrant,$1.1972,-0.0978,-7.552%,465726755.00,United States,2021,22401,Technology,Computer Software: Programming Data Processing
RUN,Sunrun Inc. Common Stock,$14.61,0.04,0.275%,3265914886.00,United States,2015,5788343,Miscellaneous,Industrial Machinery/Components
RUSHA,Rush Enterprises Inc. Common Stock Cl A,$52.13,-0.25,-0.477%,4105538916.00,United States,,224145,Consumer Discretionary,Retail-Auto Dealers and Gas Stations
RUSHB,Rush Enterprises Inc. Class B,$46.34,-0.76,-1.614%,3649542938.00,United States,,6685,Consumer Discretionary,Retail-Auto Dealers and Gas Stations
RVMD,Revolution Medicines Inc. Common Stock,$50.43,0.43,0.86%,8423773895.00,United States,2020,649297,Health Care,Biotechnology: Biological Products (No Diagnostic Substances)
RVNC,Revance Therapeutics Inc. Common Stock,$5.29,0.11,2.124%,554515421.00,United States,2014,1887082,Health Care,Biotechnology: Pharmaceutical Preparations
RWAY,Runway Growth Finance Corp. Common Stock,$10.74,0.03,0.28%,413997948.00,United States,2021,167956,Finance,Finance: Consumer Services
RWAYL,Runway Growth Finance Corp. 7.50% Notes due 2027,$25.20,0.0355,0.141%,971391834.00,United States,,3611,Finance,Finance: Consumer Services
RWAYZ,Runway Growth Finance Corp. 8.00% Notes due 2027,$25.38,0.0149,0.059%,978330347.00,United States,,459,Finance,Finance: Consumer Services
RXRX,Recursion Pharmaceuticals Inc. Class A Common Stock,$6.94,0.39,5.954%,1950893642.00,United States,2021,3627822,Health Care,Biotechnology: Biological Products (No Diagnostic Substances)
RXST,RxSight Inc. Common Stock,$50.47,0.44,0.879%,2002791118.00,United States,2021,363913,Health Care,Ophthalmic Goods
RXT,Rackspace Technology Inc. Common Stock,$2.60,0.04,1.563%,587685662.00,United States,2020,312846,Technology,Computer Software: Programming Data Processing
RYAAY,Ryanair Holdings plc American Depositary Shares,$45.43,0.68,1.52%,24963663157.00,Ireland,1997,1201860,Consumer Discretionary,Air Freight/Delivery Services
RYTM,Rhythm Pharmaceuticals Inc. Common Stock,$50.85,-0.18,-0.353%,3108651950.00,United States,2017,236568,Health Care,Biotechnology: Pharmaceutical Preparations
RZLV,Rezolve AI Limited Ordinary Shares,$5.28,-0.46,-8.014%,909125020.00,United Kingdom,,207093,Technology,Computer Software: Programming Data Processing
SABR,Sabre Corporation Common Stock,$3.66,0.04,1.105%,1411648612.00,United States,2014,2333672,Technology,Computer Software: Programming Data Processing
SAFT,Safety Insurance Group Inc. Common Stock,$84.26,-0.03,-0.036%,1250206149.00,United States,2002,31582,Finance,Property-Casualty Insurers
SAGE,Sage Therapeutics Inc. Common Stock,$7.57,0.36,4.993%,462151664.00,United States,2014,441412,Health Care,Biotechnology: Pharmaceutical Preparations
SAIA,Saia Inc. Common Stock,$436.69,-9.99,-2.237%,11611549108.00,United States,,297162,Industrials,Trucking Freight/Courier Services
SAIC,Science Applications International Corporation Common Stock,$147.695,0.055,0.037%,7313871613.00,United States,,167616,Technology,EDP Services
SANA,Sana Biotechnology Inc. Common Stock,$4.23,0.17,4.187%,941030901.00,United States,2021,567289,Health Care,Biotechnology: Biological Products (No Diagnostic Substances)
SANM,Sanmina Corporation Common Stock,$67.44,-0.76,-1.114%,3685369806.00,United States,1993,267324,Technology,Electrical Products
SASR,Sandy Spring Bancorp Inc. Common Stock,$32.61,-0.50,-1.51%,1471026371.00,United States,,195219,Finance,Major Banks
SATS,EchoStar  Corporation Common Stock,$25.38,-0.16,-0.626%,6895259212.00,United States,,1177274,Consumer Discretionary,Telecommunications Equipment
SAVA,Cassava Sciences Inc. Common Stock,$29.00,-0.575,-1.944%,1391308814.00,United States,,1345904,Health Care,Biotechnology: Pharmaceutical Preparations
SBAC,SBA Communications Corporation Class A Common Stock,$247.47,0.27,0.109%,26596210419.00,United States,1999,512095,Real Estate,Real Estate Investment Trusts
SBC,SBC Medical Group Holdings Incorporated Common Stock,$7.42,-0.08,-1.067%,747514937.00,United States,2022,27729,Health Care,Medical/Nursing Services
SBCF,Seacoast Banking Corporation of Florida Common Stock,$27.83,-0.60,-2.11%,2373875456.00,United States,,588690,Finance,Major Banks
SBGI,Sinclair Inc. Class A Common Stock,$17.19,-0.39,-2.218%,1140767989.00,United States,1995,561693,Industrials,Broadcasting
SBLK,Star Bulk Carriers Corp. Common Shares,$20.40,0.23,1.14%,2329680000.00,Greece,,1301390,Consumer Discretionary,Marine Transportation
SBRA,Sabra Health Care REIT Inc. Common Stock,$18.68,0.46,2.525%,4376047149.00,United States,,1720737,Real Estate,Real Estate Investment Trusts
SBSI,Southside Bancshares Inc. Common Stock,$34.33,-0.66,-1.886%,1039040568.00,United States,,65524,Finance,Major Banks
SBUX,Starbucks Corporation Common Stock,$96.84,1.57,1.648%,109739088000.00,United States,1992,6176393,Consumer Discretionary,Restaurants
SCHL,Scholastic Corporation Common Stock,$26.15,-0.35,-1.321%,735792853.00,United States,1992,134754,Consumer Discretionary,Books
SCSC,ScanSource Inc. Common Stock,$48.57,-1.15,-2.313%,1167177025.00,United States,,107292,Technology,Retail: Computer Software & Peripheral Equipment
SCVL,Shoe Carnival Inc. Common Stock,$39.73,-0.55,-1.365%,1079610902.00,United States,1993,208371,Consumer Discretionary,Clothing/Shoe/Accessory Stores
SCWX,SecureWorks Corp. Class A Common Stock,$8.47,0.36,4.439%,752373931.00,United States,2016,27998,Technology,Computer Software: Prepackaged Software
SDA,SunCar Technology Group Inc. Class A Ordinary Shares,$9.09,-0.11,-1.196%,815418977.00,Hong Kong,2021,472588,Consumer Discretionary,Automotive Aftermarket
SDGR,Schrodinger Inc. Common Stock,$17.80,0.21,1.194%,1295778287.00,United States,2020,546795,Health Care,Biotechnology: Pharmaceutical Preparations
SDST,Stardust Power Inc. Common Stock,$7.70,0.16,2.122%,367286982.00,United States,2021,16794,Industrials,Major Chemicals
SEAT,Vivid Seats Inc. Class A Common Stock,$4.14,0.04,0.976%,861464398.00,United States,,544080,Consumer Discretionary,Services-Misc. Amusement & Recreation
SEDG,SolarEdge Technologies Inc. Common Stock,$17.31,-0.62,-3.458%,991852683.00,Israel,2015,3516141,Technology,Semiconductors
SEIC,SEI Investments Company Common Stock,$73.35,-0.01,-0.014%,9527643335.00,United States,1981,982706,Finance,Investment Bankers/Brokers/Service
SENEA,Seneca Foods Corp. Class A Common Stock,$63.58,-1.20,-1.852%,440720411.00,United States,,13744,Consumer Staples,Packaged Foods
SENEB,Seneca Foods Corp. Class B Common Stock,$63.91,0.00,0.00%,443007887.00,United States,,113,Consumer Staples,Packaged Foods
SERV,Serve Robotics Inc. Common Stock,$9.36,0.80,9.346%,370653248.00,United States,,7646737,Consumer Discretionary,Industrial Specialties
SEZL,Sezzle Inc. Common Stock,$225.42,6.63,3.03%,1262307367.00,United States,,133129,Consumer Discretionary,Business Services
SFIX,Stitch Fix Inc. Class A Common Stock,$2.92,-0.02,-0.68%,370366484.00,United States,2017,1611685,Consumer Discretionary,Catalog/Specialty Distribution
SFM,Sprouts Farmers Market Inc. Common Stock,$115.80,-0.85,-0.729%,11595111784.00,United States,2013,618416,Consumer Staples,Food Chains
SFNC,Simmons First National Corporation Class A Common Stock,$23.28,-0.02,-0.086%,2922825278.00,United States,,757191,Finance,Major Banks
SGHT,Sight Sciences Inc. Common Stock,$5.97,0.02,0.336%,300334575.00,United States,2021,125111,Health Care,Medical/Dental Instruments
SGML,Sigma Lithium Corporation Common Shares,$14.03,0.46,3.39%,1555231982.00,Canada,,839554,Basic Materials,Metal Mining
SGRY,Surgery Partners Inc. Common Stock,$33.02,-0.01,-0.03%,4197632499.00,United States,2015,527151,Health Care,Hospital/Nursing Management
SHBI,Shore Bancshares Inc Common Stock,$14.54,-0.16,-1.088%,484418304.00,United States,,83507,Finance,Major Banks
SHC,Sotera Health Company Common Stock,$16.00,0.23,1.458%,4531429472.00,United States,2020,543417,Health Care,Misc Health and Biotechnology Services
SHCR,Sharecare Inc. Class A Common Stock,$1.435,0.005,0.35%,532285494.00,United States,2021,1793089,Health Care,Medical/Nursing Services
SHEN,Shenandoah Telecommunications Co Common Stock,$14.01,-0.09,-0.638%,764553720.00,United States,,144317,Telecommunications,Telecommunications Equipment
SHLS,Shoals Technologies Group Inc. Class A Common Stock,$5.05,0.11,2.227%,841563578.00,United States,2021,3504190,Technology,Semiconductors
SHOO,Steven Madden Ltd. Common Stock,$48.56,-0.05,-0.103%,3526265301.00,United States,1993,669848,Consumer Discretionary,Shoe Manufacturing
SHYF,The Shyft Group Inc. Common Stock,$12.84,0.02,0.156%,442502211.00,United States,,1142898,Consumer Discretionary,Auto Manufacturing
SIBN,SI-BONE Inc. Common Stock,$13.27,0.46,3.591%,553281171.00,United States,2018,221217,Health Care,Medical/Dental Instruments
SIGA,SIGA Technologies Inc. Common Stock,$6.92,-0.15,-2.122%,493875376.00,United States,,394242,Health Care,Biotechnology: Pharmaceutical Preparations
SIGI,Selective Insurance Group Inc. Common Stock,$98.68,-0.21,-0.212%,6003014157.00,United States,,233680,Finance,Property-Casualty Insurers
SIGIP,Selective Insurance Group Inc. Depositary Shares each representing a 1/1000th interest in a share of 4.60% Non-Cumulative Preferred Stock Series B,$20.10,-0.05,-0.248%,1222746094.00,United States,,7478,Finance,Property-Casualty Insurers
SIMO,Silicon Motion Technology Corporation American Depositary Shares,$55.94,-0.27,-0.48%,1884149823.00,Taiwan,2005,218808,Technology,Semiconductors
SIRI,SiriusXM Holdings Inc. Common Stock,$27.61,0.51,1.882%,10630852657.00,United States,,5967617,Consumer Discretionary,Broadcasting
SITM,SiTime Corporation Common Stock,$174.97,1.97,1.139%,4047456781.00,United States,2019,145612,Technology,Semiconductors
SKWD,Skyward Specialty Insurance Group Inc. Common Stock,$46.11,0.38,0.831%,1848832647.00,United States,2023,211946,Finance,Property-Casualty Insurers
SKYT,SkyWater Technology Inc. Common Stock,$9.82,-0.02,-0.203%,466247885.00,United States,2021,298376,Technology,Semiconductors
SKYW,SkyWest Inc. Common Stock,$95.79,1.16,1.226%,3841532274.00,United States,1986,241876,Consumer Discretionary,Air Freight/Delivery Services
SLAB,Silicon Laboratories Inc. Common Stock,$116.61,0.51,0.439%,3765236032.00,United States,2000,222821,Technology,Semiconductors
SLM,SLM Corporation Common Stock,$23.21,-0.43,-1.819%,5047278166.00,United States,,1294140,Finance,Finance: Consumer Services
SLMBP,SLM Corporation Floating Rate Non-Cumulative Preferred Stock Series B,$74.39,-0.02,-0.027%,16176950570.00,United States,,6209,Finance,Finance: Consumer Services
SLN,Silence Therapeutics Plc American Depository Share,$17.99,-0.51,-2.757%,841932000.00,United Kingdom,,194594,Health Care,Biotechnology: Pharmaceutical Preparations
SLNO,Soleno Therapeutics Inc. Common Stock,$54.16,0.66,1.234%,2105285531.00,United States,2014,692283,Health Care,Biotechnology: Electromedical & Electrotherapeutic Apparatus
SLP,Simulations Plus Inc. Common Stock,$34.15,0.86,2.583%,683264253.00,United States,,216681,Technology,EDP Services
SLRC,SLR Investment Corp. Common Stock,$15.24,0.05,0.329%,831412622.00,United States,2010,104569,Finance,Finance/Investors Services
SLRN,ACELYRIN INC. Common Stock,$6.20,-0.28,-4.321%,618811224.00,United States,2023,930207,Health Care,Biotechnology: Pharmaceutical Preparations
SMBC,Southern Missouri Bancorp Inc. Common Stock,$60.61,-0.86,-1.399%,683543640.00,United States,,42114,Finance,Banks
SMCI,Super Micro Computer Inc. Common Stock,$47.26,-0.325,-0.683%,27673814660.00,United States,2020,31855919,Technology,Computer Manufacturing
SMMT,Summit Therapeutics Inc. Common Stock ,$21.21,-0.36,-1.669%,15367445699.00,United States,2015,2156696,Health Care,Biotechnology: Pharmaceutical Preparations
SMPL,The Simply Good Foods Company Common Stock,$33.16,0.11,0.333%,3320504919.00,United States,,697496,Consumer Staples,Packaged Foods
SMTC,Semtech Corporation Common Stock,$43.88,-0.08,-0.182%,3300975767.00,United States,,1375641,Technology,Semiconductors
SNBR,Sleep Number Corporation Common Stock,$15.32,-0.79,-4.904%,342478600.00,United States,,313580,Consumer Discretionary,Home Furnishings
SNCY,Sun Country Airlines Holdings Inc. Common Stock,$12.38,0.96,8.406%,653751688.00,United States,2021,1097952,Consumer Discretionary,Air Freight/Delivery Services
